{
  "schemaVersion": "1",
  "caseId": "F7-OFFLINE-DESKTOP",
  "sourceSha": "ccab5229334bdc1343f1b5c67819916ce45a212c",
  "status": "blocked",
  "capturedAt": "2026-10-17T00:35:17Z",
  "artifact": {
    "name": "desktop-offline-p6-probe.json",
    "sizeBytes": 2522,
    "sha256": "890e99fadce933390228ceb2b5ef766e414be3121d04040f5d5d1a38581dbec4",
    "mediaType": "application/json"
  },
  "identity": {
    "host": "alexendros-aerox16",
    "operator": "archmaker-agent-p6-residuals"
  },
  "notes": [
    "DISPLAY=:0 WAYLAND_DISPLAY=wayland-0",
    "AppImage Forge local sha256=a064aee282eaef72f0e5185dc282f537cda9a38cd7eaa1d2ef09da0c363e8fbd (no published)",
    "clean-install-x3=passed",
    "boot-offline(bwrap)=passed",
    "AUSENTE: E2E portal rfd cancelar/guardar/sobrescribir/destino sin permisos",
    "MockCorePort no se usa como cierre",
    "AppImage histórico v0.1.0 NO cierra este gate",
    "Estado=blocked: portal E2E ausente; no pending ambiguo"
  ]
}
